{
  "$schema": "http://json-schema.org/draft-07/schema#",
  "type": "object",
  "properties": {
    "timestamp": {
      "type": "string"
    },
    "version": {
      "type": "string"
    },
    "stats": {
      "type": "object"
    },
    "sentinels": {
      "type": "object"
    }
  }
}