{
  "timestamp": "2025-08-23T01:59:05.795Z",
  "version": "1.0.0",
  "stats": {
    "filesAnalyzed": 110,
    "orphans": 52,
    "duplicates": 0,
    "specialEntrypoints": 6
  },
  "sentinels": {
    "aliases": {
      "aliases": {
        "@": "src"
      },
      "specialEntrypoints": [
        "src/App.jsx",
        "src/canon/contracts/index.js",
        "src/core/index.js",
        "src/main.jsx",
        "src/stores/atoms/index.js",
        "modules/state/index.js"
      ],
      "trueOrphans": [
        "src/__tests__/smoke.test.js",
        "src/bootstrap/wireSSTv3.js",
        "src/canon/console/L2.js",
        "src/canon/console/banner.js",
        "src/canon/doctor/base.js",
        "src/canon/guard/L1.js",
        "src/canon/guard/L2.js",
        "src/canon/init-amplified.js",
        "src/canon/init.js",
        "src/canon-guard/blueprintGuard.js",
        "src/canon-guard/runtime/GuardRuntimeInject.js",
        "src/components/common/ErrorBoundary.jsx",
        "src/components/theater/OpeningSequence.jsx",
        "src/components/ui/AdvancedContactPortal.jsx",
        "src/components/ui/CanvasErrorBoundary.jsx",
        "src/components/ui/Footer.jsx",
        "src/components/ui/Layout.jsx",
        "src/components/ui/NarrativeUIControls.jsx",
        "src/components/ui/ResourceMonitor.jsx",
        "src/components/ui/narrative/MemoryFragments.jsx",
        "src/components/ui/narrative/StageNavigation.jsx",
        "src/components/webgl/WebGLCanvas.jsx",
        "src/components/webgl/consciousness/ConsciousnessPatterns.js",
        "src/config/canonical/contaminationScan.js",
        "src/console-shim.js",
        "src/dev/RenderApplyShim.js",
        "src/dev/renderHealthcheck.js",
        "src/engine/TierSystem.js",
        "src/hooks/atoms/useInteractionStore.js",
        "src/hooks/atoms/useNarrativeStore.js",
        "src/hooks/atoms/usePerformanceStore.js",
        "src/hooks/atoms/useResourceStore.js",
        "src/hooks/useAdaptiveQuality.js",
        "src/hooks/useIdle.js",
        "src/hooks/useMemoryFragments.js",
        "src/hooks/useResourceTracker.js",
        "src/modules/orchestration/core/BeatBusAdapter.js",
        "src/runtime/materialFactory.js",
        "src/sections/About.jsx",
        "src/sections/Contact.jsx",
        "src/sections/Features.jsx",
        "src/stores/performanceStore.js",
        "src/theater/TheaterDirector.js",
        "src/utils/featureFlags.js",
        "src/utils/performance/DeviceCapabilities.js",
        "src/utils/performance/PerformanceMetrics.js",
        "src/utils/performance/ResourceMetrics.js",
        "src/utils/shaderUtils.js",
        "src/utils/webgl/FrustumAwareParticleGenerator.js",
        "src/utils/webgl/ShaderDebugSystem.js",
        "modules/orchestration/core/EventDebugger.js",
        "modules/orchestration/core/EventValidator.js"
      ],
      "importGraph": {
        "src/App.jsx": {
          "imports": [
            "src/components/consciousness/ConsciousnessTheater.jsx",
            "src/stores/atoms/clockAtom.js",
            "src/engine/ConsciousnessEngine.js"
          ],
          "importedBy": [
            "src/main.jsx"
          ]
        },
        "src/__tests__/smoke.test.js": {
          "imports": [],
          "importedBy": []
        },
        "src/bootstrap/wireSSTv3.js": {
          "imports": [
            "src/engine/NarrativeController.js",
            "src/engine/MemoryFragmentController.js",
            "src/stores/atoms/narrativeAtom.js"
          ],
          "importedBy": []
        },
        "src/canon/boundary.js": {
          "imports": [
            "src/canon/contracts/registry.js"
          ],
          "importedBy": [
            "src/canon/init-amplified.js"
          ]
        },
        "src/canon/console/L1.js": {
          "imports": [],
          "importedBy": [
            "src/canon/console/L2.js"
          ]
        },
        "src/canon/console/L2.js": {
          "imports": [
            "src/canon/console/L1.js"
          ],
          "importedBy": []
        },
        "src/canon/console/banner.js": {
          "imports": [],
          "importedBy": []
        },
        "src/canon/contracts/events.js": {
          "imports": [],
          "importedBy": [
            "src/canon/guard/L2.js",
            "src/modules/orchestration/core/BeatBus.js"
          ]
        },
        "src/canon/contracts/index.js": {
          "imports": [],
          "importedBy": []
        },
        "src/canon/contracts/registry.js": {
          "imports": [],
          "importedBy": [
            "src/canon/boundary.js",
            "src/canon/init-amplified.js",
            "src/canon/tests/contracts.test.js"
          ]
        },
        "src/canon/deprecation.js": {
          "imports": [],
          "importedBy": [
            "src/canon/init-amplified.js"
          ]
        },
        "src/canon/doctor/base.js": {
          "imports": [],
          "importedBy": []
        },
        "src/canon/guard/L1.js": {
          "imports": [],
          "importedBy": []
        },
        "src/canon/guard/L2.js": {
          "imports": [
            "src/canon/contracts/events.js"
          ],
          "importedBy": []
        },
        "src/canon/hud.js": {
          "imports": [],
          "importedBy": [
            "src/canon/init-amplified.js"
          ]
        },
        "src/canon/init-amplified.js": {
          "imports": [
            "src/canon/contracts/registry.js",
            "src/canon/boundary.js",
            "src/canon/hud.js",
            "src/canon/tests/contracts.test.js",
            "src/canon/deprecation.js",
            "src/canon-guard/L2.js",
            "src/canon-console/L2.js"
          ],
          "importedBy": []
        },
        "src/canon/init.js": {
          "imports": [
            "src/canon-guard/L2.js",
            "src/canon-console/L2.js"
          ],
          "importedBy": []
        },
        "src/canon/tests/contracts.test.js": {
          "imports": [
            "src/canon/contracts/registry.js"
          ],
          "importedBy": [
            "src/canon/init-amplified.js"
          ]
        },
        "src/canon-console/L1.js": {
          "imports": [],
          "importedBy": [
            "src/canon-console/L2.js"
          ]
        },
        "src/canon-console/L2.js": {
          "imports": [
            "src/canon-console/L1.js"
          ],
          "importedBy": [
            "src/canon/init-amplified.js",
            "src/canon/init.js"
          ]
        },
        "src/canon-guard/L1.js": {
          "imports": [],
          "importedBy": [
            "src/canon-guard/L2.js"
          ]
        },
        "src/canon-guard/L2.js": {
          "imports": [
            "src/canon-guard/L1.js"
          ],
          "importedBy": [
            "src/canon/init-amplified.js",
            "src/canon/init.js"
          ]
        },
        "src/canon-guard/blueprintGuard.js": {
          "imports": [
            "src/theater/events.js"
          ],
          "importedBy": []
        },
        "src/canon-guard/runtime/DegradePolicy.js": {
          "imports": [],
          "importedBy": [
            "src/canon-guard/runtime/GuardRuntimeInject.js"
          ]
        },
        "src/canon-guard/runtime/GuardRuntimeInject.js": {
          "imports": [
            "src/canon-guard/runtime/DegradePolicy.js",
            "src/theater/events.js"
          ],
          "importedBy": []
        },
        "src/components/common/ErrorBoundary.jsx": {
          "imports": [],
          "importedBy": []
        },
        "src/components/consciousness/ConsciousnessTheater.jsx": {
          "imports": [],
          "importedBy": [
            "src/App.jsx"
          ]
        },
        "src/components/dev/DebugExpose.jsx": {
          "imports": [],
          "importedBy": [
            "src/components/webgl/WebGLCanvas.jsx"
          ]
        },
        "src/components/dev/DevPerformanceMonitor.jsx": {
          "imports": [
            "src/stores/atoms/qualityAtom.js",
            "src/stores/atoms/clockAtom.js",
            "src/stores/atoms/stageAtom.js"
          ],
          "importedBy": [
            "src/components/webgl/WebGLCanvas.jsx"
          ]
        },
        "src/components/theater/OpeningSequence.jsx": {
          "imports": [],
          "importedBy": []
        },
        "src/components/ui/AdvancedContactPortal.jsx": {
          "imports": [
            "src/stores/narrativeStore.js"
          ],
          "importedBy": []
        },
        "src/components/ui/CanvasErrorBoundary.jsx": {
          "imports": [],
          "importedBy": []
        },
        "src/components/ui/Footer.jsx": {
          "imports": [],
          "importedBy": []
        },
        "src/components/ui/Layout.jsx": {
          "imports": [],
          "importedBy": []
        },
        "src/components/ui/NarrativeUIControls.jsx": {
          "imports": [],
          "importedBy": []
        },
        "src/components/ui/ResourceMonitor.jsx": {
          "imports": [
            "src/stores/resourceStore.js"
          ],
          "importedBy": []
        },
        "src/components/ui/Typewriter.jsx": {
          "imports": [
            "src/stores/useInteractionStore.js"
          ],
          "importedBy": [
            "src/sections/About.jsx"
          ]
        },
        "src/components/ui/narrative/MemoryFragments.jsx": {
          "imports": [
            "src/stores/narrativeStore.js"
          ],
          "importedBy": []
        },
        "src/components/ui/narrative/StageNavigation.jsx": {
          "imports": [
            "src/stores/narrativeStore.js"
          ],
          "importedBy": []
        },
        "src/components/webgl/WebGLBackground.jsx": {
          "imports": [
            "src/components/webgl/consciousness/PointSpriteAtlas.js",
            "src/config/canonical/canonicalAuthority.js",